{
  "$schema": "http://json-schema.org/draft-07/schema#",
  "$id": "https://trivium.local/agent-tour/tour.schema.json",
  "title": "Agent Tour",
  "description": "A guided tour of a code change, written by a coding agent and played by the Agent Tour VS Code extension.",
  "type": "object",
  "additionalProperties": false,
  "required": ["version", "id", "title", "summary", "baseRef", "createdBy", "steps"],
  "properties": {
    "version": { "const": 1 },
    "id": {
      "type": "string",
      "pattern": "^[a-z0-9][a-z0-9-]{0,80}$",
      "description": "Must equal the file name without .json."
    },
    "title": { "type": "string", "minLength": 1, "maxLength": 120 },
    "summary": { "type": "string", "maxLength": 2000 },
    "baseRef": {
      "type": "string",
      "minLength": 1,
      "maxLength": 200,
      "pattern": "^[A-Za-z0-9._/~^@{}-]+$",
      "description": "Git ref the change was diffed against."
    },
    "createdBy": { "type": "string", "minLength": 1, "maxLength": 100 },
    "steps": {
      "type": "array",
      "minItems": 1,
      "maxItems": 50,
      "items": { "$ref": "#/definitions/step" }
    }
  },
  "definitions": {
    "step": {
      "type": "object",
      "additionalProperties": false,
      "required": ["file", "range", "anchor", "kind", "title", "description"],
      "properties": {
        "file": {
          "type": "string",
          "minLength": 1,
          "maxLength": 500,
          "pattern": "^(?![/\\\\])(?![A-Za-z]:)(?!.*(^|[/\\\\])\\.\\.([/\\\\]|$))[^\\u0000]+$",
          "description": "Workspace-relative path. Absolute paths and '..' segments are rejected."
        },
        "range": {
          "type": "object",
          "additionalProperties": false,
          "required": ["start", "end"],
          "properties": {
            "start": { "type": "integer", "minimum": 1 },
            "end": { "type": "integer", "minimum": 1 }
          },
          "description": "1-based, inclusive line range. end >= start is checked outside the schema."
        },
        "anchor": { "type": "string", "minLength": 1, "maxLength": 200 },
        "kind": { "enum": ["change", "context", "risk", "decision"] },
        "title": { "type": "string", "minLength": 1, "maxLength": 120 },
        "description": { "type": "string", "maxLength": 4000 }
      }
    }
  }
}
