{
  "version": 1,
  "id": "2026-09-25-rate-limiting",
  "title": "Add rate limiting to public API",
  "summary": "Adds per-key token bucket middleware and wires it into the /api routes; /health stays unlimited. Tests cover the allow and reject paths and pass; not load-tested. Verify: the 60/min quota matches the public API docs.",
  "baseRef": "a1b2c3d",
  "createdBy": "claude-code",
  "steps": [
    {
      "file": "src/middleware/rateLimit.ts",
      "range": {
        "start": 25,
        "end": 41
      },
      "anchor": "export function rateLimiter(",
      "kind": "change",
      "title": "Token bucket middleware",
      "description": "This change has three parts: the limiter, its wiring into the router, and tests. We start with the limiter, where each request is counted.\n\n**What:** One token bucket per API key, falling back to client IP; an empty bucket answers `429`.\n\n**Why:** A token bucket allows short bursts up to `capacity` while holding the average rate. A fixed window was simpler, but lets a client double its rate across a window edge.\n\n**Watch for:** `Retry-After` is a constant `1`, not computed from the refill rate."
    },
    {
      "file": "src/middleware/rateLimit.ts",
      "range": {
        "start": 16,
        "end": 23
      },
      "anchor": "function refill(",
      "kind": "context",
      "title": "Lazy refill",
      "description": "**What:** The bucket from the previous step is refilled lazily, on each request, from the time since the last one. Nothing runs between requests.\n\n**Why:** No timer means nothing to clean up on shutdown and nothing to leak in tests."
    },
    {
      "file": "src/middleware/rateLimit.ts",
      "range": {
        "start": 14,
        "end": 14
      },
      "anchor": "const buckets = new Map",
      "kind": "risk",
      "title": "Unbounded in-memory state",
      "description": "**What:** Buckets live in a process-local `Map` keyed by API key or IP.\n\n**Watch for:** Nothing ever removes an entry, so a client rotating IPs grows memory without bound. Limits are also per process: behind a load balancer with three instances, a client gets three times the quota. Neither is tested."
    },
    {
      "file": "src/router.ts",
      "range": {
        "start": 11,
        "end": 12
      },
      "anchor": "const publicApi = rateLimiter(",
      "kind": "decision",
      "title": "Scope: `/api` only",
      "description": "**What:** The limiter from the first step is mounted on `/api` only; `/health` stays unlimited.\n\n**Why:** Load balancer probes hit `/health` every few seconds and must never get a `429`. Mounting it app-wide and exempting `/health` inside the limiter was the alternative; it puts routing knowledge into the middleware."
    },
    {
      "file": "test/rateLimit.test.ts",
      "range": {
        "start": 16,
        "end": 22
      },
      "anchor": "it(\"rejects with 429",
      "kind": "change",
      "title": "Rejection test",
      "description": "**What:** Drains a capacity-1 bucket and checks that the second request gets `429`.\n\n**Watch for:** Refill is switched off (`refillPerSecond: 0`) so the test doesn't depend on wall-clock time, which means the refill path from the second step is not tested at all."
    }
  ]
}
